{
  "$schema": "https://json-schema.org/draft/2020-12/schema",
  "$id": "https://nexus.local/contracts/v1/proposal.schema.json",
  "title": "Proposal",
  "description": "A request, usually from the planner, to execute one action with concrete params. It carries the context it was derived from, with origins, so the gate can tell user intent from instructions found in data.",
  "type": "object",
  "additionalProperties": false,
  "required": ["proposal_id", "session_id", "action", "params", "rationale", "context", "proposer", "created_at"],
  "properties": {
    "proposal_id": {"description": "Unique id of this proposal.", "$ref": "common.schema.json#/$defs/uuid"},
    "session_id": {"description": "Session the proposal belongs to; sessions never see each other's state.", "$ref": "common.schema.json#/$defs/uuid"},
    "plan_id": {"description": "Plan this proposal is a step of.", "$ref": "common.schema.json#/$defs/uuid"},
    "depends_on": {"description": "Proposals that must succeed first.", "type": "array", "items": {"$ref": "common.schema.json#/$defs/uuid"}, "uniqueItems": true},
    "action": {"description": "Qualified action id.", "$ref": "common.schema.json#/$defs/qualified_action_id"},
    "params": {"description": "Parameters; validated against the action's params schema by the gate.", "type": "object"},
    "rationale": {"description": "Why the proposer wants this; shown to approvers.", "type": "string", "minLength": 1, "maxLength": 2000},
    "context": {
      "description": "Context items the proposal was derived from, each with its origin.",
      "type": "array",
      "minItems": 1,
      "items": {
        "type": "object",
        "additionalProperties": false,
        "required": ["source", "ref", "triggered"],
        "properties": {
          "source": {"$ref": "common.schema.json#/$defs/taint_source"},
          "ref": {"description": "Pointer to the item (message id, document chunk, tool call).", "type": "string", "minLength": 1, "maxLength": 256},
          "triggered": {"description": "True for the single item that prompted the proposal.", "type": "boolean"}
        }
      }
    },
    "proposer": {"$ref": "common.schema.json#/$defs/actor"},
    "idempotency_key": {"description": "Key that makes resubmission safe.", "type": "string", "minLength": 8, "maxLength": 128},
    "created_at": {"$ref": "common.schema.json#/$defs/timestamp"}
  }
}
