{
  "proposal_id": "6f1c2a3e-8b4d-4e5f-9a1b-2c3d4e5f6a7b",
  "session_id": "0b7e9c1d-2f3a-4b5c-8d6e-7f8091a2b3c4",
  "plan_id": "a1b2c3d4-e5f6-4a7b-8c9d-0e1f2a3b4c5d",
  "action": "stf:oven.set_zone_temp",
  "params": {
    "zone": 2,
    "temp": 240
  },
  "rationale": "The user asked to set zone two to 240 degrees; zone 2 is idle.",
  "context": [
    {
      "source": "user",
      "ref": "msg/42",
      "triggered": true
    },
    {
      "source": "tool",
      "ref": "read/oven.zone[2].mode",
      "triggered": false
    },
    {
      "source": "doc",
      "ref": "corpus/oven.md#L10-L24",
      "triggered": false
    }
  ],
  "proposer": {
    "kind": "agent",
    "id": "planner"
  },
  "idempotency_key": "6f1c2a3e-zone2-240",
  "created_at": "2026-10-30T10:00:00Z"
}
